{
    "schema_version": "1.0",
    "system": {
        "name": "PayFlux",
        "version": "1.0.0",
        "generated_at": "2026-02-16T20:59:59Z"
    },
    "domains": [
        {
            "name": "Persistence",
            "layer": "foundation",
            "path": "internal/logsafe/, Redis, filesystem",
            "purpose": "PII redaction, Redis Streams, atomic file writes",
            "depends_on": []
        },
        {
            "name": "Config",
            "layer": "foundation",
            "path": "internal/config/, config/",
            "purpose": "Signal resolution, runtime overrides, audit logging, runtime JSON configs",
            "depends_on": []
        },
        {
            "name": "Observability",
            "layer": "foundation",
            "path": "internal/metrics/",
            "purpose": "Prometheus metrics for signals, tiers, enforcement, entitlements",
            "depends_on": []
        },
        {
            "name": "Rate Limiting",
            "layer": "foundation",
            "path": "internal/ratelimit/",
            "purpose": "Atomic token-bucket rate limiter (Redis Lua)",
            "depends_on": []
        },
        {
            "name": "Runtime",
            "layer": "core",
            "path": "internal/runtime/",
            "purpose": "Decision engine, adaptive baseline, causal analysis, deployment safety loop",
            "depends_on": []
        },
        {
            "name": "Risk",
            "layer": "core",
            "path": "risk_score.go, warnings.go",
            "purpose": "Sliding-window risk scoring, risk band classification, warning store",
            "depends_on": []
        },
        {
            "name": "Tiers",
            "layer": "core",
            "path": "internal/tiers/",
            "purpose": "Tier registry, tier-to-signal mapping, wildcard pattern matching",
            "depends_on": []
        },
        {
            "name": "Entitlements",
            "layer": "core",
            "path": "internal/entitlements/",
            "purpose": "Tier entitlements registry, enforcement middleware, concurrency limiter, retention enforcement",
            "depends_on": []
        },
        {
            "name": "Evidence",
            "layer": "core",
            "path": "internal/evidence/",
            "purpose": "Evidence envelope generation, canonicalization, deterministic JSON output",
            "depends_on": []
        },
        {
            "name": "API",
            "layer": "interface",
            "path": "main.go, evidence_handler.go, pilot_dashboard.go",
            "purpose": "HTTP ingest, evidence export, pilot dashboard, health endpoints",
            "depends_on": []
        },
        {
            "name": "Admin",
            "layer": "interface",
            "path": "internal/admin/",
            "purpose": "Internal signal override API handlers",
            "depends_on": []
        },
        {
            "name": "CLI",
            "layer": "interface",
            "path": "cmd/",
            "purpose": "Binary entry points: consumer, decision-engine, signalctl, test-runner, generators",
            "depends_on": []
        },
        {
            "name": "Specs",
            "layer": "support",
            "path": "internal/specs/",
            "purpose": "Signal registry schema, registry validation",
            "depends_on": []
        },
        {
            "name": "Test Harness",
            "layer": "support",
            "path": "internal/testharness/",
            "purpose": "Anomaly detection testing, merchant simulation, telemetry analysis",
            "depends_on": []
        },
        {
            "name": "Infrastructure",
            "layer": "support",
            "path": "deploy/, Dockerfile, scripts/",
            "purpose": "Docker, docker-compose, k8s, systemd, Vector, deployment scripts",
            "depends_on": []
        },
        {
            "name": "Dashboard",
            "layer": "external",
            "path": "apps/dashboard/",
            "purpose": "Next.js-based trust dashboard (separate TypeScript application)",
            "depends_on": []
        },
        {
            "name": "Architecture",
            "layer": "support",
            "path": "internal/archscanner/",
            "purpose": "Static architecture contract enforcement",
            "depends_on": []
        }
    ],
    "primitives": [
        {
            "name": "RiskScorer",
            "layer": "Risk",
            "responsibility": "Sliding-window per-processor risk scoring with weighted multi-component model",
            "inputs": [
                "Event (event_type, processor, failure_origin, retry_count, geo_bucket, result)"
            ],
            "outputs": [
                "RiskResult (score, band, drivers, trajectory)"
            ],
            "determinism": "deterministic",
            "bounded": true,
            "hash": "46745d35cfe047f4fd4d8ce624a1b603b3854be778a70f32f9e2bf79c7b22a9f",
            "file": "risk_score.go",
            "notes": "Same event sequence over same window produces identical score. Fixed-size bucket array per processor, score clamped to [0, 1]."
        },
        {
            "name": "WarningStore",
            "layer": "Risk",
            "responsibility": "LRU-bounded in-memory storage of risk warnings with outcome annotation",
            "inputs": [
                "Warning (risk score, band, drivers, processor, merchant, event metadata)"
            ],
            "outputs": [
                "[]*Warning (filtered, ordered, with outcome fields)"
            ],
            "determinism": "deterministic",
            "bounded": true,
            "hash": "459c19bffcd1d66082f968e0e68118f01b3002a68b070f3a262b91c22f64008d",
            "file": "warnings.go",
            "notes": "LRU eviction is ordered, outcome annotation is idempotent. Fixed capacity, oldest entries evicted."
        },
        {
            "name": "AdaptiveBaseline",
            "layer": "Runtime",
            "responsibility": "Exponential-smoothing baseline learning for error rate, P95 latency, and memory",
            "inputs": [
                "Metrics (ErrorRate, P95, MemoryMB)"
            ],
            "outputs": [
                "snapshot (means and variances for all metrics)",
                "deviation score (float64)"
            ],
            "determinism": "conditional",
            "bounded": true,
            "hash": "3b183fb40b6c4111563d78af78502fb13985dc3100e19ff66faf6a3ef8661e7f",
            "file": "internal/runtime/guardian/baseline.go",
            "notes": "deviationScore() and z() are pure functions. Update() is deterministic given identical input order, but output depends on accumulated state history. Replay of the same metric sequence from the same initial snapshot produces identical results. Sample count capped at 100,000."
        },
        {
            "name": "TierRegistry",
            "layer": "Tiers",
            "responsibility": "Precompiled tier-to-signal mapping with O(1) exact-match and O(n) wildcard lookup",
            "inputs": [
                "TierConfig (JSON mapping of tier to signal patterns)"
            ],
            "outputs": [
                "bool (IsSignalAllowed)",
                "[]string (GetAllowedSignals)"
            ],
            "determinism": "deterministic",
            "bounded": true,
            "hash": "2eed1bd6ed95ea01e78cb6968841093cfd7bf604652e295202e1f8dd768850ea",
            "file": "internal/tiers/tier_registry.go",
            "notes": "Compiled from static JSON config, atomic.Value for lock-free reads. Four tiers (baseline, proof, shield, fortress), finite signal set."
        },
        {
            "name": "EntitlementsRegistry",
            "layer": "Entitlements",
            "responsibility": "Tier-specific capability and limit management with fail-closed defaults",
            "inputs": [
                "EntitlementsConfig (JSON mapping of tier to entitlement values)"
            ],
            "outputs": [
                "Entitlements (retention_days, alert_routing, SLA, max_concurrent, export_formats)"
            ],
            "determinism": "deterministic",
            "bounded": true,
            "hash": "1edcf9af30ef7b9cfb9a789236265044204fa91e0cfb004325004cd4d07e8aac",
            "file": "internal/entitlements/entitlements.go",
            "notes": "O(1) lookup via atomic.Value, fail-closed on unknown tier. Four tiers, validated ranges for all fields."
        },
        {
            "name": "OverrideStore",
            "layer": "Config",
            "responsibility": "Thread-safe copy-on-write storage for runtime signal overrides",
            "inputs": [
                "SignalOverride (enabled, severity, threshold, expires_at, reason_code)"
            ],
            "outputs": [
                "SignalOverride",
                "map[string]SignalOverride"
            ],
            "determinism": "deterministic",
            "bounded": true,
            "hash": "70960d3afb0a82d061103a0c179e38809a3d75530b3e7a8671dfb4740e6ede44",
            "file": "internal/config/signal_overrides.go",
            "notes": "Copy-on-write semantics, atomic.Value for lock-free reads. Bounded by signal count, overrides expire via TTL."
        },
        {
            "name": "GenerateEnvelope",
            "layer": "Evidence",
            "responsibility": "Deterministic evidence assembly: Filter → Normalize → Stabilize → Sort → Clamp → Canonicalize",
            "inputs": [
                "[]Merchant",
                "[]ArtifactSource",
                "[]Narrative",
                "SystemState",
                "*Meta"
            ],
            "outputs": [
                "Envelope (schemaVersion, generatedAt, meta, payload)"
            ],
            "determinism": "deterministic",
            "bounded": true,